homeTeam,homeTeamScore,awayTeam,awayTeamScore,videoID,datePlayed,title
West Brom,1,Swansea City,2,pTy9nEzQ1Lg,5/21/17,Swansea City rally past West Brom in season finale
Tottenham,7,Hull City,1,KQbscSbtaQM,5/21/17,Harry Kane scores hat trick as Tottenham demolish Hull
Southampton,0,Stoke City,1,B3SO4GTo8Ng,5/21/17,Stoke City stifle Southampton in 1-0 win
Arsenal,3,Everton,1,Q0iCfmDEGiw,5/21/17,Arsenal beat Everton  but miss top 4 spot
Liverpool,3,Middlesbrough,0,YJTf-sWcYqg,5/21/17,Liverpool beat Middlesbrough 3-0 to secure top 4 finish
Manchester City,5,Watford,0,0zr8_3jRaXk,5/21/17,Man City secure Champions League spot with win over Watford
Chelsea,5,Sunderland,1,wzhWyTYfNpk,5/21/17,Chelsea top Sunderland to cap title-winning season
Bournemouth,1,Leicester City,1,L5tOK2lBOF0,5/21/17,Bournemouth draw Leicester to reach top half
Burnley,1,West Ham,2,hGavkn29HxI,5/21/17,West Ham come from behind to beat Burnley
Manchester United,2,Crystal Palace,0,qrNBh2XdFRc,5/21/17,Man United's youngsters take down Crystal Palace
Tottenham,6,Leicester City,1,NxKLFj0RpI8,5/18/17,Harry Kane  Tottenham demolish Leicester City
Manchester United,0,Southampton,0,4ciK9-Sjna4,5/17/17,Manchester United winless streak extended in draw against Southampton
Manchester City,3,West Brom,1,k0kPbXwpRzk,5/16/17,Man City dominate West Bromwich  hold Top 4 spot
Arsenal,2,Sunderland,0,wSZam2wwV1I,5/16/17,Alexis Sanchez leads Arsenal past Sunderland
Chelsea,4,Watford,3,RpCjOZ1PBu8,5/15/17,Chelsea top Watford  tie record with 29th Premier League win
Hull City,0,Crystal Palace,4,IHYYybNjpe4,5/14/17,Hull City relegated after 4-0 shut out by Palace
Liverpool,4,West Ham,0,vdGmLMklSW4,5/14/17,Liverpool cruise past West Ham in 4-0 win
Tottenham,2,Manchester United,1,m9lq15CHXoU,5/14/17,Tottenham top Man United in White Hart Lane finale
Manchester City,2,Leicester City,1,NaOR4pe3tl0,5/13/17,Man City hold on to defeat Leicester City 2-1
Bournemouth,2,Burnley,1,547QO8cCGPE,5/13/17,Bournemouth earn exciting 2-1 win over Burnley
Arsenal,4,Stoke City,1,Jg2lOFRwMzM,5/13/17,Arsenal overwhelm Stoke City in 4-1 win
Swansea City,2,Sunderland,0,SMlTYiHwgc0,5/13/17,Swansea top Sunderland  move closer to PL survival
Southampton,2,Middlesbrough,1,XkqRvTil-uY,5/13/17,Southampton clip Middlesbrough 2-1
Everton,1,Watford,0,mX0TylQRt2c,5/12/17,Everton cruise to 1-0 win over Watford
Chelsea,1,West Brom,0,b3jIDQ55dIg,5/12/17,Chelsea top West Brom  clinch Premier league title
Arsenal,2,Southampton,0,UF3uFpJgE4E,5/10/17,Arsenal push past Southampton in 2-0 win
Chelsea,3,Middlesbrough,0,eDTz6k6ctZs,5/8/17,Chelsea top Middlesbrough  one win from PL title
Manchester United,0,Arsenal,2,YD0sR-nK77g,5/7/17,Arsenal top Man United  keep top four hopes alive
Liverpool,0,Southampton,0,pI0k9PdTJJw,5/7/17,Southampton stifle Liverpool in 0-0 draw
Everton,0,Swansea City,1,TnZX0qcZOGM,5/6/17,Swansea top Everton to move out of relegation zone
West Brom,2,Burnley,2,F3LFHMqm4ZU,5/6/17,Burnley  West Brom play to exciting 2-2 draw
Manchester City,5,Crystal Palace,0,bIAzGVkFQJc,5/6/17,Man City thump Crystal Palace 5-0
Hull City,0,Sunderland,2,WfpwJ0tJZ-0,5/6/17,Hull drop vital points to Sunderland in 2-0 loss
Bournemouth,2,Stoke City,2,o9luWAiBQPk,5/6/17,Bournemouth  Stoke share the points in 2-2 draw
Leicester City,3,Watford,0,3vdBs2oxay4,5/6/17,Albrighton  Mahrez help Leicester beat Watford
Tottenham,0,West Ham,1,e2upXuyLWdw,5/5/17,West Ham  Lanzini top Tottenham
Manchester United,0,Arsenal,2,SeMStmCGIGw,5/7/17,Man United  Arsenal clash eying top four
Liverpool,1,Watford,0,mdvmyD22wP0,5/1/17,Liverpool's Can scores sensational overhead kick against Watford
Tottenham,2,Arsenal,0,dEcZvAkgwaA,4/30/17,Tottenham top Arsenal in North London derby
Manchester United,1,Swansea City,1,C2rNthffcBA,4/30/17,Swansea City earn 1-1 draw against Man United
Chelsea,3,Everton,0,TzawDcN0X8w,4/30/17,Chelsea's big second half leads to win v. Everton
Manchester City,2,Middlesbrough,2,cFyf8iu6INk,4/30/17,Middlesbrough  Man City play to exciting 2-2 draw
Stoke City,0,West Ham,0,d_aWxn-1uPA,4/29/17,Stoke City  West Ham share points in 0-0 draw
Southampton,0,Hull City,0,9rE-UPdzUfs,4/29/17,Hull City draw Southampton  get important point
Bournemouth,1,Sunderland,0,LczGx-lSs4o,4/29/17,Bournemouth win through late goal v. Sunderland
West Brom,0,Leicester City,1,tGwXSZUMZhY,4/29/17,Leicester City get past West Brom with 1-0 win
Burnley,2,Crystal Palace,0,T235Fosho2E,4/29/17,Burnley clip Crytsal Palace 2-0
Manchester United,0,Manchester City,0,G9Ft8V30IHA,4/27/17,Man City and Man United played to a 0-0 draw in a derby filled with missed scoring chances and a late red card for Marouane Fellaini.
Arsenal,1,Leicester City,0,UE2Tn2xuBxw,4/26/17,Arsenal beat Leicester through Huth's own goal
Middlesbrough,1,Sunderland,0,w4kUrwe2Iyg,4/26/17,Middlesbrough clip Sunderland in relegation battle
Tottenham,1,Crystal Palace,0,u6MTXDJU9ik,4/26/17,Christian Eriksen leads Tottenham past Palace
Chelsea,4,Southampton,2,ZU2p03HZfOk,4/25/17,Chelsea regain form  top Southampton 4-2
Liverpool,1,Crystal Palace,2,QUIP_SFKMqY,4/23/17,Benteke's two goals leads Crystal Palace over Liverpool
Manchester United,2,Burnley,0,VPgup8Vb-8c,4/23/17,Wayne Rooney's goal leads Man United to win over Burnley
Watford,0,Hull City,2,QoZD_72gcqI,4/22/17,Clucas leads 10-man Hull City to win over Watford
Bournemouth,4,Middlesbrough,0,el1LLg4kzcQ,4/22/17,Bournemouth blow past Middlesbrough
Stoke City,0,Swansea City,2,SFFVGIoevBI,4/22/17,Llorente helps Swansea stifle Stoke City
Everton,0,West Ham,0,ifWJJdwz7EM,4/22/17,West Ham  Everton play to scoreless draw
Arsenal,2,Middlesbrough,1,r99cBO9FTMw,4/17/17,Arsenal get past Middlesbrough for 2-1 win
Chelsea,0,Manchester United,2,nLVz-8RwGDU,4/16/17,Chelsea fall to Manchester United as title race gets tighter
Liverpool,1,West Brom,0,NObzadtdaRI,4/16/17,Liverpool get past West Brom in 1-0 win
Chelsea,0,Manchester United,2,hdOHbXEm8dk,4/16/17,Rashford provides breakthrough for Man United against Chelsea
Manchester City,3,Southampton,0,X4jrmYR6CsA,4/15/17,Man City beat Southampton to move into third
West Ham,2,Sunderland,2,3V19pVRu5N4,4/15/17,Sunderland salvage draw against West Ham
Stoke City,3,Hull City,1,SjZsL8-hdX4,4/15/17,Stoke City too much for Hull City in 3-1 win
Watford,1,Swansea City,0,CbYQ12geHQ8,4/15/17,Etienne Capoue helps Watford to win over Swansea
Everton,3,Burnley,1,NUvcZsMxrzk,4/15/17,Barkley  Lukaku secure Everton win over Burnley
Leicester City,2,Crystal Palace,2,HSaWJNPusGQ,4/15/17,Palace come back to earn draw with Leicester
Stoke City,3,Hull City,1,SjZsL8-hdX4,4/15/17,"Stoke City got goals from three different players, including a stunning strike from Xeherdan Shaqiri as they topped Hull City 3-1 on Matchday 33."
Tottenham,4,Bournemouth,0,FWlQ6KRC87s,4/15/17,Tottenham dominate Bournemouth in 4-0 win
Arsenal,0,Crystal Palace,3,RmYaZiyngs0,4/10/17,Crystal Palace embarrasses Arsenal
Everton,4,Leicester City,2,QFs6UE6QxQk,4/9/17,Lukaku doubles to lead Everton past Leicester
Manchester United,3,Sunderland,0,WRo3IwRfsbg,4/9/17,Man United handle 10-man Sunderland in 3-0 win
Tottenham,4,Watford,0,KPzaqA2ImNI,4/8/17,Tottenham score four goals in Watford blowout
Manchester City,3,Hull City,1,vKu20kVewJs,4/8/17,Man City dominate Hull City in 3-1 win
West Ham,1,Swansea City,0,uIWhg4Wmdl0,4/8/17,West Ham  Cheikhou Kouyate top Swansea City
Chelsea,3,Bournemouth,1,KTvYPMDL134,4/8/17,Chelsea cruise past Bournemouth to hold title lead
Burnley,0,Middlesbrough,0,YqzBkho0XGM,4/8/17,Burnley holds Middlesbrough to draw
Liverpool,2,Stoke City,1,Cz98yPXwf_o,4/8/17,Liverpool comeback to beat Stoke City
West Brom,0,Southampton,1,rRp3jy3UUy0,4/8/17,Southampton clip West Brom Albion in 1-0 win
Tottenham,3,Swansea City,1,jN1nMDC1g38,4/5/17,Tottenham leave it late  top Swansea City 3-1
Southampton,3,Crystal Palace,1,Cf6o5KVThSA,4/5/17,Southampton comeback to beat Crystal Palace
Liverpool,2,Bournemouth,2,krQLbmdb0Ew,4/5/17,Liverpool concede late to draw with Bournemouth
Hull City,4,Middlesbrough,2,yJnCY4tIG8o,4/5/17,Hull City outlast Middlesbrough in 4-2 win
Chelsea,2,Manchester City,1,B-dPaWw-4RY,4/5/17,Chelsea earn massive 2-1 win over Man City
Arsenal,3,West Ham,0,eA4mmJC_-sA,4/5/17,Arsenal complete 3-0 rout of West Ham
Manchester United,1,Everton,1,QbSLM-ZNhys,4/4/17,Late goal helps Man United draw with Everton
Leicester City,2,Sunderland,0,xb1ZN622beQ,4/4/17,Leicester top Sunderland  win fifth straight in PL
West Brom,0,Watford,2,wT0KcMZKpLc,4/4/17,Watford earn 2-0 victory over West Brom
Stoke City,0,Burnley,1,nDyq-__tBTA,4/4/17,Burnley clip Stoke City in 1-0 win
Manchester United,0,West Brom,0, -maeEHE2CRo,4/1/17,Manchester United held to draw v. West Brom
Leicester City,2,Stoke City,0,G324Cjs7mKQ,4/1/17,Leicester beat Stoke  get fourth straight PL win
West Ham,1,Hull City,2,5ilTukYuAq0,4/1/17,Robertson and Ranocchia rally Hull City for win over West Ham
Tottenham,2,Burnley,0,mRtE6i4hzH0,4/1/17,Tottenham leave it late  but top Burnley 2-0
Watford,1,Sunderland,0,Fg7gBRV-HmU,4/1/17,Watford clip Sunderland 1-0
Southampton,0,Bournemouth,0,1gCBfY5u0_Y,4/1/17,Southampton  Bournemouth draw 0-0
Chelsea,1,Crystal Palace,2,S4wM6k_GDSA,4/1/17,Crystal Palace stun Chelsea at Stamford Bridge
Liverpool,3,Everton,1,I05ckonGAA0,4/1/17,Liverpool maintain Merseyside Derby dominance over Everton
Liverpool,1,Manchester City,1, -lSYXFICjy0,3/19/17,Man City  Liverpool play to thrilling 1-1 draw
Manchester United,3,Middlesbrough,1,HYAnqREIb64,3/19/17,Manchester United hold on to beat Middlesbrough
Tottenham,2,Southampton,1,uUUNGKccBm4,3/19/17,Tottenham top Southampton 2-1 at White Hart Lane
Bournemouth,2,Swansea City,0,WRLLm8xUGv8,3/18/17,Bournemouth shut out Swansea 2-0
Everton,4,Hull City,0,FchHI5S2Gcs,3/18/17,Romelu Lukaku leads Everton rout of Hull City
Watford,0,Crystal Palace,1,-852pkbdKko,3/18/17,Troy Deeney's own goal gives Crystal Palace the win over Watford
Burnley,0,Sunderland,0,X1b1fSOagW4,3/18/17,Sunderland  Burnley play to scoreless draw
Arsenal,1,West Brom,3,rq1vuEisAm8,3/18/17,Arsenal fall to West Brom 3-1
Leicester City,3,West Ham,2,zzEUggLjOsQ,3/18/17,Leicester City stay hot with 3-2 win over West Ham
Chelsea,2,Stoke City,1,fMGUWddMCPM,3/18/17,Chelsea get past Stoke City with 2-1 victory
Liverpool,2,Burnley,1,Bc3WaUBORz4,3/12/17,Liverpool comeback to beat Burnley 2-1
Bournemouth,3,West Ham,2,GZ7YcYymbd0,3/11/17,Joshua King's hat-trick leads Bournemouth past West Ham
Hull City,2,Swansea City,1,hMC756JqPcg,3/11/17,Oumar Niasse's double helps Hull City beat Swansea
Everton,3,West Brom,0,J8Dx_nw0Vgs,3/11/17,Everton top West Brom in 3-0 blowout
Manchester City,0,Stoke City,0,gI4XKNSwq1I,3/8/17,Man City's missed chances lead to scoreless draw with Stoke
Chelsea,2,West Ham,1,iDFHuDTp24Y,3/6/17,Chelsea continue Premier League dominance defeating West Ham
Middlesbrough,0,Stoke City,2,LNioSO44hiI,3/4/17,Marko Arnautovic's two goals lifted Stoke City past Middlesbrough at the Bet 365 Stadium.
Sunderland,0,Manchester City,2,gkXR8No9t9o,3/5/17,Manchester City handle Sunderland 2-0
Tottenham,3,Everton,2,qVxnYmIitzE,3/5/17,Tottenham beat Everton 3-2 as Harry Kane dominates
Burnley,2,Swansea City,3,01j08KmeIyw,3/4/17,Llorente leads Swansea past Burnley
Leicester City,3,Hull City,1,70PWyDv93Bg,3/4/17,Leicester score three unanswered goals to top Hull
Liverpool,3,Arsenal,1,51woOX_Leog,3/4/17,Liverpool beat Arsenal  rise to third in PL table
Manchester United,1,Bournemouth,1,ItZknodKDNY,3/4/17,Bournemouth steals point from Old Trafford after 1-1 draw with Man United
Southampton,4,Watford,3,445nXqPTlJA,3/4/17,Southampton beat Watford in high-scoring affair at Vicarage Road
Liverpool,1,Leicester City,3,rSLhHJF6GAQ,2/27/17,Leicester get much needed win over Liverpool
Tottenham,4,Stoke City,0,N0u95WGdIac,2/26/17,Harry Kane secures hat-trick in Tottenham's win over Stoke
Crystal Palace,1,Middlesbrough,0,goDIIWLY_hs,2/25/17,"In an important match in the relegation battle, Crystal Palace earned the three points against Middlesbrough thanks to a goal from Patrick Van Aanholt."
Watford,1,West Ham,1,xWt39r61EK4,2/25/17,Watford  West Ham share points in 1-1 draw
Everton,2,Sunderland,0,JX2Gu7I5HQg,2/25/17,Everton beat Sunderland to stay red-hot
Burnley,1,Hull City,1,AXtT0CqfaCA,2/25/17,Hull City  Burnley exchange late goals in draw
Chelsea,3,Swansea City,1,4xLCJLTmp-c,2/25/17,Chelsea extend title lead with win over Swansea
West Brom,2,Bournemouth,1,_FgvmGbaiaA,2/25/17,West Brom top Bournemouth for 2-1 win
Liverpool,1,Leicester City,3,fPGPZntgdBU,2/27/17,Premier League preview: Leicester City v. Liverpool
Manchester City,2,Bournemouth,0,j-BYaUSUofY,2/13/17,Sterling  Aguero help Man City beat Bournemouth
Leicester City,0,Swansea City,2,qVelU-wyhvQ,2/12/17,Leicester struggles continue in loss to Swansea
Chelsea,1,Burnley,1,w-tMQiVbekI,2/12/17,Burnley  Chelsea play to hard-fought draw
Tottenham,0,Liverpool,2,gIOwOT4CJxM,2/11/17,Sadio Mane  Liverpool beat Tottenham 2-0
Southampton,4,Sunderland,0,OpUoRtgdasU,2/11/17,Southampton hammer Sunderland 4-0
Everton,0,Middlesbrough,0,ziY_yyWJOCw,2/11/17,Middlesbrough  Everton draw 0-0
Manchester United,2,Watford,0,7HUPB4oSJw0,2/11/17,Manchester United power past Watford in 2-0 win
West Brom,2,West Ham,2,x1AbhlEKaAQ,2/11/17,West Ham  West Brom play to thrilling 2-2 draw
Stoke City,1,Crystal Palace,0,138MFFd_2BQ,2/11/17,Joe Allen's goal lifts Stoke past Crystal Palace
Arsenal,2,Hull City,0,Y6lLN4JG0LI,2/11/17,Alexis Sanchez's brace leads Arsenal past Hull
Manchester United,3,Leicester City,0,Ai7NYLoHNhU,2/5/17,Manchester United blowout Leicester City
Manchester City,2,Swansea City,1,0UK5CcPdUdA,2/5/17,Gabriel Jesus brace leads Man City past Swansea
Southampton,1,West Ham,3,G86LiG2_SSo,2/4/17,West Ham beat Southampton 3-1
Tottenham,1,Middlesbrough,0,Q4nBRhX2Aqc,2/4/17,Tottenham get past Middlesbrough in 1-0 win
Liverpool,0,Hull City,2,9y5Rh344x0A,2/4/17,Hull City shock Liverpool with 2-0 win
Sunderland,4,Crystal Palace,0,5ehDx4jP-QA,2/4/17,Sunderland put four goals past Palace in win
Watford,2,Burnley,1,ady5ij0uVcU,2/4/17,Watford hold on to beat 10-man Burnley 2-1
Chelsea,3,Arsenal,1,0Qo9ps8vthg,2/4/17,Chelsea cruise past Arsenal for 3-1 win
Everton,6,Bournemouth,3,CjDCjttVGuw,2/4/17,Lukaku leads Everton to 6-3 win over Bournemouth
Everton,1,Stoke City,1,m_kJvGHNHTM,2/1/17,Stoke City  Everton settle for 1-1 draw
Manchester United,0,Hull City,0,laP07E97If4,2/1/17,Hull City stifle Manchester United in 0-0 draw
Manchester City,4,West Ham,0,u9pCrdlPU0Q,2/1/17,Man City too much for West Ham in 4-0 blowout
Southampton,1,Swansea City,2,7xiYCIyctXs,1/31/17,Swansea earn second straight win  beat Southampton
Chelsea,1,Liverpool,1,wXzNKMkaVJU,1/31/17,Liverpool  Chelsea share points in 1-1 draw
West Brom,1,Middlesbrough,1,t7rLZkbDjOU,1/31/17,Middlesbrough  West Brom play to 1-1 draw
Bournemouth,0,Crystal Palace,2,2blkHux_v0U,1/31/17,Crystal Palace power past Bournemouth in 2-0 win
Arsenal,1,Watford,2,bKkCkbWZuhY,1/31/17,Watford clip Arsenal in 2-1 win
Tottenham,0,Sunderland,0,G7E-PEPBOBw,1/31/17,Sunderland earn draw against Tottenham
Leicester City,0,Burnley,1,i7egyQF4qhk,1/31/17,Burnley score late to get win against Leicester
Chelsea,1,Liverpool,1,QsW7CmteVAA,1/31/17,Chelsea set to visit struggling Liverpool at Anfield
Southampton,3,Leicester City,0,0wKpv4sEeE0,1/22/17,Southampton stifle Leicester City in 3-0 win
Arsenal,2,Burnley,1,V8FPdwuH8XI,1/22/17,Arsenal snatch win from Burnley with late PK
Chelsea,2,Hull City,0,8Z83zbFS3Kk,1/22/17,Chelsea beat Hull City as Diego Costa returns
West Ham,3,Middlesbrough,1,e3xGKzX42dw,1/21/17,West Ham too much for Middlesbrough in 3-1 win
Everton,1,Crystal Palace,0,vW2zbL0LoMo,1/21/17,Everton get late goal to earn win over Palace
Liverpool,2,Swansea City,3,eAgJqt8ltnU,1/21/17,Swansea City shock Liverpool in 3-2 thriller
West Brom,2,Sunderland,0,41eo49cVwM8,1/21/17,West Brom power past Sunderland for 2-0 win
Manchester United,1,Stoke City,1,CyvE-Rtmm1Q,1/21/17,Wayne Rooney's historic goal forces Man United's 1-1 draw with Stoke City
Tottenham,2,Manchester City,2,zgXTuSnG23k,1/21/17,"Manchester City opened the second half with two quick goals, but could not maintain their lead as Tottenham came back to earn a point with a 2-2 draw."
Bournemouth,2,Watford,2,UB1kdWfqOx4,1/21/17,Bournemouth come back to earn draw with Watford
Liverpool,1,Manchester United,1,TZW3iTc08l0,1/15/17,Man United  Liverpool share points in 1-1 draw
Everton,1,Crystal Palace,0,BuLkFq7mCOQ,1/21/17,Everton top Manchester City in 4-0 blowout
Chelsea,3,Leicester City,0,G0sEEy7BO00,1/14/17,Even without Costa  Chelsea crush Leicester
Tottenham,4,West Brom,0,iuHbp3sOk4o,1/14/17,Kane's hat-trick leads Tottenham past West Brom
Watford,0,Middlesbrough,0,4QtUBOsRhvE,1/14/17,Watford  Middlesbrough play to scoreless draw
Southampton,0,Burnley,1,ydUOwutg64o,1/14/17,Joey Barton's goal helps Burnley past Southampton
Stoke City,3,Sunderland,1,IfMqji-U9lA,1/14/17,Stoke City power past Sunderland in 3-1 win
Bournemouth,1,Hull City,3,FMFuaX7lO7g,1/14/17,Hull City come back to beat Bournemouth 3-1
Arsenal,4,Swansea City,0,6GEfTCNMlBM,1/14/17,Arsenal too much for Swansea City in 4-0 win
West Ham,3,Crystal Palace,0,f1HTpWYh6_0,1/14/17,West Ham thrash Crystal Palace in 3-0 win
Arsenal,3,Bournemouth,3,PuZozAYyXxU,1/3/17,Arsenal come back in 3-3 thriller v. Bournemouth
Crystal Palace,1,Swansea City,2,XwTbG8sTHSc,1/3/17,Swansea earn vital relegation battle win v. Crystal Palace
Stoke City,2,Watford,0,rMdFQXqo7ww,1/3/17,Stoke City handle Watford in 2-0 win
Everton,3,Southampton,0,jVSkDQ22b1c,1/2/17,Everton pull away from Southampton for 3-0 win
West Brom,3,Hull City,1,JA46KzuFEFU,1/2/17,West Brom power past Hull City in 3-1 win
Burnley,1,Manchester City,2,Tqa7jgQoZfk,1/2/17,10-man Manchester City beat Burnley 2-1
Manchester United,2,West Ham,0,LastE_ZtdY0,1/2/17,Man United earn 6th straight PL win v. 10-man West Ham
Leicester City,0,Middlesbrough,0,LAoO_Lkw8Ng,1/2/17,Middlesbrough  Leicester play to scoreless draw
Liverpool,2,Sunderland,2,wUKF7oe0x0I,1/2/17,Sunderland earn 2-2 draw against Liverpool
Tottenham,4,Watford,1,bASx1vnXs6Q,1/1/17,Harry Kane  Dele Alli lead Tottenham past Watford
Arsenal,2,Crystal Palace,0,JuYwGwQOu4I,1/1/17,Giroud's wondergoal sparks Arsenal to win over Crystal Palace
Chelsea,4,Stoke City,2,Yq35nevQ3e8,12/31/16,Chelsea top Stoke City in 4-2 thriller
Leicester City,1,West Ham,0,FUbZ-kE8jPo,12/31/16,Leicester City hold off West Ham for 1-0 win
Burnley,4,Sunderland,1,6XCqThr_YGU,12/31/16,Andre Gray's hat-trick leads Burnley to win over Sunderland
Bournemouth,3,Swansea City,0,bMi5s5LJMqI,12/31/16,Bournemouth puts three goals past Swansea in win
West Brom,2,Southampton,1,W0zAy_qgtHM,12/31/16,Southampton score first  but fall to West Brom
Manchester United,2,Middlesbrough,1,ceLw9g0rrms,12/31/16,Manchester United come back to beat Middlesbrough
Liverpool,1,Manchester City,0,R3YqoBnA3Dw,12/31/16,Wijnaldum's goal helps Liverpool to ugly win over Manchester City
Hull City,2,Everton,2,4YmYvYOkki8,12/30/16,"Hull City held a 2-1 lead late in the second half, but Ross Barkley's late equalizer secured a point for the Toffees."
Tottenham,4,Southampton,1,hHFiYz0ezVw,12/28/16,Dele Alli sparks Tottenham rout of Southampton
Liverpool,4,Stoke City,1,NCLTGPuZVI0,12/27/16,Liverpool score four unanswered goal to beat Stoke
Manchester City,3,Hull City,0,QxiM1Zv9k6s,12/26/16,Toure  Iheanacho spark Man City's second half dominance vs. Hull City
West Ham,4,Swansea City,1,BCCHOI2Pcds,12/26/16,West Ham hammer Swansea City 4-1
Arsenal,1,West Brom,0,PNNmm_gZmg4,12/26/16,Olivier Giroud's late goal gives Arsenal the win over West Brom
Burnley,1,Middlesbrough,0,VHRt0GfVuc0,12/26/16,Andre Gray's late goal pushes Burnley past Middlesbrough
Everton,2,Leicester City,0,Zvqqd7xeYLU,12/26/16,Everton use strong second half to beat Leicester City
Manchester United,3,Sunderland,1,s8Xa4wAJqSQ,12/26/16,Manchester United continue to roll with 3-1 win over Sunderland
Watford,1,Crystal Palace,1,Zehg_I6WuJo,12/26/16,Watford  Crystal Palace play to 1-1 draw on Boxing Day
Chelsea,3,Bournemouth,0,q7jgFM63VQA,12/26/16,Chelsea thump Bournemouth for 12th straight win
Liverpool,1,Everton,0,170quwYWEgY,12/19/16,Liverpool escape Merseyside derby with win over Everton
Swansea City,0,Middlesbrough,3,viDz9Smh8oo,12/17/16,Swansea City no match for Middlesbrough in 3-0 defeat
Chelsea,1,Crystal Palace,0,48L_9lbPfAw,12/17/16,Chelsea beat Crystal Palace for 11th straight win
West Ham,1,Hull City,0,aQ2r993ploY,12/17/16,Mark Noble's penalty kick goal helps West Ham past Hull City
Manchester United,2,West Brom,0,zQE5oLpHKEI,12/17/16,Zlatan Ibrahimovic scores two goals as Manchester United best West Brom
Leicester City,2,Stoke City,2,wIaWaUppyB4,12/17/16,10-man Leicester City comeback to earn 2-2 draw v. Stoke City
Watford,0,Sunderland,1,7ar7aa9Fm_A,12/17/16,Sunderland top Watford in 1-0 win
Southampton,3,Bournemouth,1,odb7-O4DtOo,12/18/16,Jay Rodriguez's brace leads Southampton past Bournemouth
Tottenham,2,Burnley,1,TC_IDhJN_zk,12/18/16,Dele Alli  Danny Rose score as Tottenham beat Burnley 2-1
Arsenal,1,Manchester City,2,ypuoN0Rm3o4,12/18/16,Dominant second half helps Manchester City beat Arsenal 2-1
Burnley,0,West Ham,1,wOkltfvxwiM,12/14/16,West Ham edge Burnley 1-0 for pivotal win
Southampton,0,Stoke City,0,KK6cWIZv6wY,12/14/16,Stoke City  Southampton play to scoreless draw
Tottenham,3,Hull City,0,MJS-sxqTveg,12/14/16,Tottenham trounce Hull City 3-0
West Brom,3,Swansea City,1,rV_b9dtEwWI,12/14/16,Salomon Rondon's hat trick leads West Brom past Swansea City
Manchester United,2,Crystal Palace,1,vRWc_a4gKIk,12/14/16,Zlatan Ibrahimovic's late goal helps Manchester United past Crystal Palace
Watford,1,Crystal Palace,1,UaHmLnUVHQo,12/26/16,Manchester City too much for Watford in 2-0 win
Liverpool,3,Middlesbrough,0,qUjYGUZbLkQ,12/14/16,Liverpool dismantle Middlesbrough in 3-0 win
Chelsea,1,Sunderland,0,yHJHM72O_eA,12/14/16,Chelsea top Sunderland  wins 10th straight
Arsenal,1,Everton,2,yuvBGnBWsfg,12/13/16,Ashley Williams provides late winner as Everton top Arsenal
Bournemouth,1,Leicester City,0,N-UsBSiXc3A,12/13/16,Bournemouth hold on to top Leicester City 1-0
Liverpool,2,West Ham,2,ZTBES2Tc54s,12/11/16,Liverpool draw 2-2 with West Ham
Southampton,1,Middlesbrough,0,Aal2cOmxwd8,12/11/16,Southampton clip Middlesbrough for win
Tottenham,0,Manchester United,1,H5QoneNMBy0,12/11/16,Henrikh Mkhitaryan's goal helps Manchester United beat Tottenham
Chelsea,1,West Brom,0,u73zxazkdcI,12/11/16,Diego Costa leads Chelsea past West Brom for ninth straight win
Manchester City,2,Leicester City,4,96qmy_q4RuU,12/10/16,Jamie Vardy's incredible hat trick seals a Leicester win v. Man City
Crystal Palace,3,Hull City,3,eLxfhMKr1hk,12/10/16,Hull CIty  Crystal Palace play to 3-3 draw
Bournemouth,2,Burnley,3,zhe8RwLIIl4,12/10/16,Burnley holds on to beat Bournemouth 3-2
Arsenal,3,Stoke City,1,8pzcqNCgzfE,12/10/16,Arsenal put three goals past Stoke City in win
Swansea City,3,Sunderland,0,J7kQ_98GvkU,12/10/16,Swansea City dismantle Sunderland in big win
Everton,2,Watford,3,QRrN_aXckgg,12/10/16,Watford comes back from a goal down to beat Everton
Hull City,4,Middlesbrough,2,j3xb6I3xsos,12/5/16,Middlesbrough get by Hull City
Manchester United,1,Everton,1,spb6lS4wIDU,12/4/16,Manchester United and Everton play to 1-1 draw
Liverpool,3,Bournemouth,4,AlI5VHMZflo,12/4/16,Bournemouth tops Liverpool 4-3 with thrilling comeback
Arsenal,5,West Ham,1,XAnkKGgSw5s,12/3/16,Arsenal dominate West Ham in 5-1 win
Stoke City,2,Burnley,0,tCj7EwsWG3o,12/3/16,Stoke City handle Burnley 2-0
Southampton,0,Crystal Palace,3,rOFRSJfgB3k,12/3/16,Crystal Palace bury Southampton in three-goal win
Tottenham,5,Swansea City,0,5C5MKH4oXBQ,12/3/16,Tottenham thump Swansea City 5-0
West Brom,3,Watford,1,XdNfa9n4SLo,12/3/16,West Brom top Watford 3-1
Leicester City,1,Sunderland,2,deBr8zrwbCM,12/3/16,Sunderland hold off Leicester City for 2-1 win
Chelsea,3,Manchester City,1,c19lUekl5kY,12/3/16,Chelsea beats Man City after strong second half
Arsenal,3,Bournemouth,1,8PrppNhQscY,11/27/16,Alexis Sanchez leads Arsenal over Bournemouth
Manchester United,1,West Ham,1,iFXZ4dQOCSM,11/27/16,Manchester United  West Ham play to 1-1 draw
Everton,0,Southampton,1,VXHgIctLM48,11/27/16,Southampton beats Everton in Ronald Koeman's return
Stoke City,1,Watford,0,o-thGQaUE1I,11/27/16,Stoke City edge Watford through own goal
Chelsea,2,Tottenham,1,m4Ngda5D43M,11/26/16,Chelsea edges Tottenham on Victor Moses goal
Leicester City,2,Middlesbrough,2,KSka9P20NvE,11/26/16,Leicester City draws Middlesbrough off Islam Slimani's penalty shot goal
Burnley,3,Crystal Palace,2,imPdT0k3dNk,11/5/16,Manchester City sneak out win v. Burnley with Sergio Aguero brace
West Brom,1,Hull City,1,_6xSFzV8yYU,11/26/16,Hull City draw West Bromwich Albion as Gareth McAuley  Michael Dawson score
Liverpool,2,Sunderland,0,MloMqM0glZA,11/26/16,Liverpool top Sunderland behind Divock Origi  James Milner goals
Crystal Palace,4,Swansea City,5,#NAME?,11/26/16,Swansea City wins wild match over Crystal Palace
West Brom,4,Burnley,0,XVDj7_wH0Dc,11/21/16,Matt Phillips  West Brom blank Burnley  4-0
Chelsea,1,Middlesbrough,0,7nEBqj3_-Hg,11/20/16,Chelsea clip Middlesbrough 1-0
Tottenham,3,West Ham,2,CaKZX5-Uco8,11/19/16,Tottenham steals win from West Ham with late comeback
Bournemouth,1,Stoke City,0,CoSIrrcOEgc,11/19/16,Bournemouth tops Stoke City
Crystal Palace,1,Manchester City,2,vsLBX5qPTQQ,11/19/16,Yaya Toure leads Manchester City to victory over Crystal Palace
Liverpool,0,Southampton,0,8GmO_-AVx8c,11/19/16,Southampton stymies Liverpool to earn 0-0 draw
Manchester United,1,Arsenal,1,90O_ivs9pDA,11/19/16,Manchester United  Arsenal play to 1-1 draw
