Team1,Score1,Team2,Score2,video link,date,title
West Brom,,Swansea City,,pTy9nEzQ1Lg,5/21/17,Swansea City rally past West Brom in season finale
Tottenham,,Hull City,,KQbscSbtaQM,5/21/17,Harry Kane scores hat trick as Tottenham demolish Hull
Southampton,,Stoke City,,B3SO4GTo8Ng,5/21/17,Stoke City stifle Southampton in 1-0 win
Arsenal,,Everton,,Q0iCfmDEGiw,5/21/17,Arsenal beat Everton  but miss top 4 spot
Liverpool,,Middlesbrough,,YJTf-sWcYqg,5/21/17,Liverpool beat Middlesbrough 3-0 to secure top 4 finish
Manchester City,,Watford,,0zr8_3jRaXk,5/21/17,Man City secure Champions League spot with win over Watford
Chelsea,,Sunderland,,wzhWyTYfNpk,5/21/17,Chelsea top Sunderland to cap title-winning season
Bournemouth,,Leicester City,,L5tOK2lBOF0,5/21/17,Bournemouth draw Leicester to reach top half
Burnley,,West Ham,,hGavkn29HxI,5/21/17,West Ham come from behind to beat Burnley
Manchester United,,Crystal Palace,,qrNBh2XdFRc,5/21/17,Man United's youngsters take down Crystal Palace
Tottenham,,Leicester City,,NxKLFj0RpI8,5/19/17,Harry Kane  Tottenham demolish Leicester City
Manchester United,,Southampton,,4ciK9-Sjna4,5/18/17,Manchester United winless streak extended in draw against Southampton
Manchester City,,West Brom,,k0kPbXwpRzk,5/17/17,Man City dominate West Bromwich  hold Top 4 spot
Arsenal,,Sunderland,,wSZam2wwV1I,5/17/17,Alexis Sanchez leads Arsenal past Sunderland
Chelsea,,Watford,,RpCjOZ1PBu8,5/15/17,Chelsea top Watford  tie record with 29th Premier League win
Hull City,,Palace,,IHYYybNjpe4,5/15/17,Hull City relegated after 4-0 shut out by Palace
Liverpool,,West Ham,,vdGmLMklSW4,5/15/17,Liverpool cruise past West Ham in 4-0 win
Tottenham,,Manchester United,,m9lq15CHXoU,5/15/17,Tottenham top Man United in White Hart Lane finale
Manchester City,,Leicester City,,NaOR4pe3tl0,5/13/17,Man City hold on to defeat Leicester City 2-1
Bournemouth,,Burnley,,547QO8cCGPE,5/13/17,Bournemouth earn exciting 2-1 win over Burnley
Arsenal,,Stoke City,,Jg2lOFRwMzM,5/13/17,Arsenal overwhelm Stoke City in 4-1 win
Swansea City,,Sunderland,,SMlTYiHwgc0,5/13/17,Swansea top Sunderland  move closer to PL survival
Southampton,,Middlesbrough,,XkqRvTil-uY,5/13/17,Southampton clip Middlesbrough 2-1
Everton,,Watford,,mX0TylQRt2c,5/13/17,Everton cruise to 1-0 win over Watford
Chelsea,,West Brom,,b3jIDQ55dIg,5/13/17,Chelsea top West Brom  clinch Premier league title
Hull City,,Swansea City,,_WGkhhZe0Ko,5/11/17,Hull  Swansea fighting against relegation
Arsenal,,Southampton,,UF3uFpJgE4E,5/11/17,Arsenal push past Southampton in 2-0 win
Chelsea,,Middlesbrough,,eDTz6k6ctZs,5/9/17,Chelsea top Middlesbrough  one win from PL title
Manchester United,,Arsenal,,YD0sR-nK77g,5/7/17,Arsenal top Man United  keep top four hopes alive
Liverpool,,Southampton,,pI0k9PdTJJw,5/7/17,Southampton stifle Liverpool in 0-0 draw
Everton,,Swansea City,,TnZX0qcZOGM,5/6/17,Swansea top Everton to move out of relegation zone
West Brom,,Burnley,,F3LFHMqm4ZU,5/6/17,Burnley  West Brom play to exciting 2-2 draw
Manchester City,,Crystal Palace,,bIAzGVkFQJc,5/6/17,Man City thump Crystal Palace 5-0
Hull City,,Sunderland,,WfpwJ0tJZ-0,5/6/17,Hull drop vital points to Sunderland in 2-0 loss
Bournemouth,,Stoke City,,o9luWAiBQPk,5/6/17,Bournemouth  Stoke share the points in 2-2 draw
Leicester City,,Watford,,3vdBs2oxay4,5/6/17,Albrighton  Mahrez help Leicester beat Watford
Tottenham,,West Ham,,e2upXuyLWdw,5/6/17,West Ham  Lanzini top Tottenham
Manchester United,,Arsenal,,SeMStmCGIGw,5/6/17,Man United  Arsenal clash eying top four
Liverpool,,Watford,,jh6Ot4Y4UnQ,5/2/17,Can's overhead kick pushes Liverpool past Watford
Liverpool,,Watford,,mdvmyD22wP0,5/1/17,Liverpool's Can scores sensational overhead kick against Watford
Tottenham,,Arsenal,,dEcZvAkgwaA,4/30/17,Tottenham top Arsenal in North London derby
Manchester United,,Swansea City,,C2rNthffcBA,4/30/17,Swansea City earn 1-1 draw against Man United
Stoke City,,West Ham,,d_aWxn-1uPA,4/30/17,Stoke City  West Ham share points in 0-0 draw
Southampton,,Hull City,,9rE-UPdzUfs,4/30/17,Hull City draw Southampton  get important point
Bournemouth,,Sunderland,,LczGx-lSs4o,4/30/17,Bournemouth win through late goal v. Sunderland
West Brom,,Leicester City,,tGwXSZUMZhY,4/30/17,Leicester City get past West Brom with 1-0 win
Burnley,,Palace,,T235Fosho2E,4/30/17,Burnley clip Crytsal Palace 2-0
Chelsea,,Everton,,TzawDcN0X8w,4/30/17,Chelsea's big second half leads to win v. Everton
Manchester City,,Middlesbrough,,cFyf8iu6INk,4/30/17,Middlesbrough  Man City play to exciting 2-2 draw
Manchester United,0,Manchester City,0,G9Ft8V30IHA,4/27/17,Man City and Man United played to a 0-0 draw in a derby filled with missed scoring chances and a late red card for Marouane Fellaini.
Arsenal,,Leicester City,,UE2Tn2xuBxw,4/26/17,Arsenal beat Leicester through Huth's own goal
Middlesbrough,,Sunderland,,w4kUrwe2Iyg,4/26/17,Middlesbrough clip Sunderland in relegation battle
Tottenham,,Palace,,u6MTXDJU9ik,4/26/17,Christian Eriksen leads Tottenham past Palace
Tottenham,,Crystal Palace,,vIwanFcXGAI,4/26/17,Eriksen's long-range strike puts Tottenham ahead against Crystal Palace
Middlesbrough,,Sunderland,,jB08xiBGm8I,4/26/17,Marten De Roon gives Middlesbrough an early lead over Sunderland
Chelsea,,Southampton,,ZU2p03HZfOk,4/25/17,Chelsea regain form  top Southampton 4-2
Chelsea,,Southampton,,uJjGP2vPihA,4/25/17,Diego Costa extends Chelsea's lead over Southampton
Chelsea,,Southampton,,lCSKCo_oezU,4/25/17,Southampton's Oriol Romeu's tap-in equalizes against Chelsea
Chelsea,,Southampton,,In-jD0UfBJo,4/25/17,Eden Hazard gives Chelsea an early lead against Southampton
Liverpool,,Crystal Palace,,QUIP_SFKMqY,4/23/17,Benteke's two goals leads Crystal Palace over Liverpool
Manchester United,,Burnley,,VPgup8Vb-8c,4/23/17,Wayne Rooney's goal leads Man United to win over Burnley
Watford,,Hull City,,QoZD_72gcqI,4/22/17,Clucas leads 10-man Hull City to win over Watford
Bournemouth,,Middlesbrough,,el1LLg4kzcQ,4/22/17,Bournemouth blow past Middlesbrough
Stoke City,,Swansea City,,SFFVGIoevBI,4/22/17,Llorente helps Swansea stifle Stoke City
Everton,,West Ham,,ifWJJdwz7EM,4/22/17,West Ham  Everton play to scoreless draw
Chelsea,,Tottenham,,6lbAXUpNF_k,4/19/17,Tottenham could edge out Chelsea for title
Arsenal,,Middlesbrough,,r99cBO9FTMw,4/17/17,Arsenal get past Middlesbrough for 2-1 win
Arsenal,,Middlesbrough,,U9XqZR0UK7s,4/17/17,Sanchez's stunning free kick puts Arsenal in front of Middlesbrough
Chelsea,,Manchester United,,LRzdM7fch-g,4/17/17,Ander Herrera on Man United's win over Chelsea
Chelsea,,Manchester United,,nLVz-8RwGDU,4/16/17,Chelsea fall to Manchester United as title race gets tighter
Liverpool,,West Brom,,NObzadtdaRI,4/16/17,Liverpool get past West Brom in 1-0 win
Chelsea,,Manchester United,,hdOHbXEm8dk,4/16/17,Rashford provides breakthrough for Man United against Chelsea
Manchester City,,Southampton,,X4jrmYR6CsA,4/15/17,Man City beat Southampton to move into third
West Ham,,Sunderland,,3V19pVRu5N4,4/15/17,Sunderland salvage draw against West Ham
Stoke City,,Hull City,,SjZsL8-hdX4,4/15/17,Stoke City too much for Hull City in 3-1 win
Watford,,Swansea City,,CbYQ12geHQ8,4/15/17,Etienne Capoue helps Watford to win over Swansea
Everton,,Burnley,,NUvcZsMxrzk,4/15/17,Barkley  Lukaku secure Everton win over Burnley
Leicester City,2,Palace,2,HSaWJNPusGQ,4/15/17,Palace come back to earn draw with Leicester
Stoke City,3,Hull City,1,SjZsL8-hdX4,4/15/17,"Stoke City got goals from three different players, including a stunning strike from Xeherdan Shaqiri as they topped Hull City 3-1 on Matchday 33."
Crystal Palace,,Palace,,mtRMDjAwQrs,4/15/17,Yohan Cabaye gets a goal back for Crystal Palace
Tottenham,,Bournemouth,,FWlQ6KRC87s,4/15/17,Tottenham dominate Bournemouth in 4-0 win
Arsenal,,Crystal Palace,,RmYaZiyngs0,4/11/17,Crystal Palace embarrasses Arsenal
Arsenal,,Crystal Palace,,Yc2xrxjMuMM,4/10/17,Crystal Palace's Townsend scores to take the lead over Arsenal
Everton,,Leicester City,,QFs6UE6QxQk,4/9/17,Lukaku doubles to lead Everton past Leicester
Manchester United,,Sunderland,,WRo3IwRfsbg,4/9/17,Man United handle 10-man Sunderland in 3-0 win
Tottenham,,Watford,,KPzaqA2ImNI,4/9/17,Tottenham score four goals in Watford blowout
Manchester City,,Hull City,,vKu20kVewJs,4/8/17,Man City dominate Hull City in 3-1 win
West Ham,,Swansea City,,uIWhg4Wmdl0,4/8/17,West Ham  Cheikhou Kouyate top Swansea City
Chelsea,,Bournemouth,,KTvYPMDL134,4/8/17,Chelsea cruise past Bournemouth to hold title lead
Burnley,,Middlesbrough,,YqzBkho0XGM,4/8/17,Burnley holds Middlesbrough to draw
Liverpool,,Stoke City,,Cz98yPXwf_o,4/8/17,Liverpool comeback to beat Stoke City
West Brom,,Southampton,,rRp3jy3UUy0,4/8/17,Southampton clip West Brom Albion in 1-0 win
Chelsea,,Tottenham,,9Pr4fecTNGo,4/7/17,Chelsea still in control  Tottenham surging in latest Premier League Power Rankings
Tottenham,,Swansea City,,jN1nMDC1g38,4/6/17,Tottenham leave it late  top Swansea City 3-1
Southampton,,Crystal Palace,,Cf6o5KVThSA,4/6/17,Southampton comeback to beat Crystal Palace
Liverpool,,Bournemouth,,krQLbmdb0Ew,4/5/17,Liverpool concede late to draw with Bournemouth
Hull City,,Middlesbrough,,yJnCY4tIG8o,4/5/17,Hull City outlast Middlesbrough in 4-2 win
Chelsea,,Manchester City,,B-dPaWw-4RY,4/5/17,Chelsea earn massive 2-1 win over Man City
Arsenal,,West Ham,,eA4mmJC_-sA,4/5/17,Arsenal complete 3-0 rout of West Ham
Arsenal,,West Ham,,I7I0B1TMpdA,4/5/17,Arsenal's Mesut Ozil makes it 1-0 against West Ham
Liverpool,,Bournemouth,,t-Gfw8mVdH0,4/5/17,Liverpool's Philippe Coutinho equalizes against Bournemouth
Chelsea,,Manchester City,,J8dDKGY52Y4,4/5/17,Chelsea's Eden Hazard misses penalty kick  scores rebound v. Man City
Southampton,,Crystal Palace,,fuWkr7mHiO4,4/5/17,Crystal Palace's Christian Benteke opens the scoring against Southampton
Tottenham,,Swansea City,,NRSOe6F24us,4/5/17,Swansea City's Wayne Routledge opens the scoring against Tottenham
Chelsea,,Manchester City,,uO3UrHpltsk,4/5/17,Chelsea's Eden Hazard notches a goal against Man City
Liverpool,,Bournemouth,,TdWYbuBEPNw,4/5/17,Bournemouth's Benik Afobe capitalizes on turnover against Liverpool
Hull City,,Middlesbrough,,Lf_I7fURQmw,4/5/17,Middlesbrough's Alvaro Negredo puts his side ahead against Hull City
Manchester United,,Everton,,QbSLM-ZNhys,4/4/17,Late goal helps Man United draw with Everton
Leicester City,,Sunderland,,xb1ZN622beQ,4/4/17,Leicester top Sunderland  win fifth straight in PL
West Brom,,Watford,,wT0KcMZKpLc,4/4/17,Watford earn 2-0 victory over West Brom
Stoke City,,Burnley,,nDyq-__tBTA,4/4/17,Burnley clip Stoke City in 1-0 win
Leicester City,,Sunderland,,MfxiYuLLih8,4/4/17,Leicester's Slimani scores header vs. Sunderland
Manchester United,,Everton,,DATZYnjtKKM,4/4/17,Jagielka puts Everton in front against Man United
Manchester United,,West Brom,, -maeEHE2CRo,4/2/17,Manchester United held to draw v. West Brom
Leicester City,,Stoke City,,G324Cjs7mKQ,4/2/17,Leicester beat Stoke  get fourth straight PL win
West Ham,,Hull City,,5ilTukYuAq0,4/1/17,Robertson and Ranocchia rally Hull City for win over West Ham
Tottenham,,Burnley,,mRtE6i4hzH0,4/1/17,Tottenham leave it late  but top Burnley 2-0
Watford,,Sunderland,,Fg7gBRV-HmU,4/1/17,Watford clip Sunderland 1-0
Southampton,,Bournemouth,,1gCBfY5u0_Y,4/1/17,Southampton  Bournemouth draw 0-0
Chelsea,,Crystal Palace,,S4wM6k_GDSA,4/1/17,Crystal Palace stun Chelsea at Stamford Bridge
Liverpool,,Everton,,I05ckonGAA0,4/1/17,Liverpool maintain Merseyside Derby dominance over Everton
Liverpool,,Manchester City,, -lSYXFICjy0,3/19/17,Man City  Liverpool play to thrilling 1-1 draw
Manchester United,,Middlesbrough,,HYAnqREIb64,3/19/17,Manchester United hold on to beat Middlesbrough
Tottenham,,Southampton,,uUUNGKccBm4,3/19/17,Tottenham top Southampton 2-1 at White Hart Lane
Bournemouth,,Swansea City,,WRLLm8xUGv8,3/18/17,Bournemouth shut out Swansea 2-0
Everton,,Hull City,,FchHI5S2Gcs,3/18/17,Romelu Lukaku leads Everton rout of Hull City
Watford,,Crystal Palace,,-852pkbdKko,3/18/17,Troy Deeney's own goal gives Crystal Palace the win over Watford
Burnley,,Sunderland,,X1b1fSOagW4,3/18/17,Sunderland  Burnley play to scoreless draw
Arsenal,,West Brom,,rq1vuEisAm8,3/18/17,Arsenal fall to West Brom 3-1
Leicester City,,West Ham,,zzEUggLjOsQ,3/18/17,Leicester City stay hot with 3-2 win over West Ham
Chelsea,,Stoke City,,fMGUWddMCPM,3/18/17,Chelsea get past Stoke City with 2-1 victory
Liverpool,,Burnley,,Bc3WaUBORz4,3/12/17,Liverpool comeback to beat Burnley 2-1
Bournemouth,,West Ham,,GZ7YcYymbd0,3/11/17,Joshua King's hat-trick leads Bournemouth past West Ham
Hull City,,Swansea City,,hMC756JqPcg,3/11/17,Oumar Niasse's double helps Hull City beat Swansea
Everton,,West Brom,,J8Dx_nw0Vgs,3/11/17,Everton top West Brom in 3-0 blowout
Manchester City,,Stoke City,,gI4XKNSwq1I,3/9/17,Man City's missed chances lead to scoreless draw with Stoke
Manchester City,,Stoke City,,tml5ZZ-Fabc,3/8/17,Wednesday Preview: Can Man City get 200th home win vs. Stoke?
Chelsea,,West Ham,,iDFHuDTp24Y,3/7/17,Chelsea continue Premier League dominance defeating West Ham
Middlesbrough,0,Stoke City,2,LNioSO44hiI,3/5/17,Marko Arnautovic's two goals lifted Stoke City past Middlesbrough at the Bet 365 Stadium.
Sunderland,,Crystal Palace,,gkXR8No9t9o,3/5/17,Manchester City handle Sunderland 2-0
Tottenham,,Everton,,qVxnYmIitzE,3/5/17,Tottenham beat Everton 3-2 as Harry Kane dominates
Burnley,,Swansea City,,01j08KmeIyw,3/5/17,Llorente leads Swansea past Burnley
Leicester City,,Hull City,,70PWyDv93Bg,3/5/17,Leicester score three unanswered goals to top Hull
Liverpool,,Arsenal,,51woOX_Leog,3/5/17,Liverpool beat Arsenal  rise to third in PL table
Manchester United,,Bournemouth,,ItZknodKDNY,3/5/17,Bournemouth steals point from Old Trafford after 1-1 draw with Man United
Southampton,,Watford,,445nXqPTlJA,3/5/17,Southampton beat Watford in high-scoring affair at Vicarage Road
Liverpool,,Leicester City,,rSLhHJF6GAQ,2/28/17,Leicester get much needed win over Liverpool
Tottenham,,Stoke City,,N0u95WGdIac,2/26/17,Harry Kane secures hat-trick in Tottenham's win over Stoke
Crystal Palace,1,Middlesbrough,0,goDIIWLY_hs,2/25/17,"In an important match in the relegation battle, Crystal Palace earned the three points against Middlesbrough thanks to a goal from Patrick Van Aanholt."
Watford,,West Ham,,xWt39r61EK4,2/25/17,Watford  West Ham share points in 1-1 draw
Everton,,Sunderland,,JX2Gu7I5HQg,2/25/17,Everton beat Sunderland to stay red-hot
Burnley,,Hull City,,AXtT0CqfaCA,2/25/17,Hull City  Burnley exchange late goals in draw
Chelsea,,Swansea City,,4xLCJLTmp-c,2/25/17,Chelsea extend title lead with win over Swansea
West Brom,,Bournemouth,,_FgvmGbaiaA,2/25/17,West Brom top Bournemouth for 2-1 win
Liverpool,,Leicester City,,fPGPZntgdBU,2/23/17,Premier League preview: Leicester City v. Liverpool
Manchester City,,Bournemouth,,j-BYaUSUofY,2/14/17,Sterling  Aguero help Man City beat Bournemouth
Leicester City,,Swansea City,,qVelU-wyhvQ,2/12/17,Leicester struggles continue in loss to Swansea
Chelsea,,Burnley,,w-tMQiVbekI,2/12/17,Burnley  Chelsea play to hard-fought draw
Tottenham,,Liverpool,,gIOwOT4CJxM,2/11/17,Sadio Mane  Liverpool beat Tottenham 2-0
Southampton,,Sunderland,,OpUoRtgdasU,2/11/17,Southampton hammer Sunderland 4-0
Everton,,Middlesbrough,,ziY_yyWJOCw,2/11/17,Middlesbrough  Everton draw 0-0
Manchester United,,Watford,,7HUPB4oSJw0,2/11/17,Manchester United power past Watford in 2-0 win
West Brom,,West Ham,,x1AbhlEKaAQ,2/11/17,West Ham  West Brom play to thrilling 2-2 draw
Stoke City,,Crystal Palace,,138MFFd_2BQ,2/11/17,Joe Allen's goal lifts Stoke past Crystal Palace
Arsenal,,Hull City,,Y6lLN4JG0LI,2/11/17,Alexis Sanchez's brace leads Arsenal past Hull
Manchester United,,Leicester City,,Ai7NYLoHNhU,2/5/17,Manchester United blowout Leicester City
Manchester City,,Swansea City,,0UK5CcPdUdA,2/5/17,Gabriel Jesus brace leads Man City past Swansea
Southampton,,West Ham,,G86LiG2_SSo,2/4/17,West Ham beat Southampton 3-1
Tottenham,,Middlesbrough,,Q4nBRhX2Aqc,2/4/17,Tottenham get past Middlesbrough in 1-0 win
Liverpool,,Hull City,,9y5Rh344x0A,2/4/17,Hull City shock Liverpool with 2-0 win
Sunderland,,Palace,,5ehDx4jP-QA,2/4/17,Sunderland put four goals past Palace in win
Watford,,Burnley,,ady5ij0uVcU,2/4/17,Watford hold on to beat 10-man Burnley 2-1
Chelsea,,Arsenal,,0Qo9ps8vthg,2/4/17,Chelsea cruise past Arsenal for 3-1 win
Everton,,Bournemouth,,CjDCjttVGuw,2/4/17,Lukaku leads Everton to 6-3 win over Bournemouth
Everton,,Stoke City,,m_kJvGHNHTM,2/2/17,Stoke City  Everton settle for 1-1 draw
Manchester United,,Hull City,,laP07E97If4,2/2/17,Hull City stifle Manchester United in 0-0 draw
Manchester City,,West Ham,,u9pCrdlPU0Q,2/2/17,Man City too much for West Ham in 4-0 blowout
Southampton,,Swansea City,,7xiYCIyctXs,2/1/17,Swansea earn second straight win  beat Southampton
Chelsea,,Liverpool,,wXzNKMkaVJU,2/1/17,Liverpool  Chelsea share points in 1-1 draw
West Brom,,Middlesbrough,,t7rLZkbDjOU,2/1/17,Middlesbrough  West Brom play to 1-1 draw
Bournemouth,,Crystal Palace,,2blkHux_v0U,2/1/17,Crystal Palace power past Bournemouth in 2-0 win
Arsenal,,Watford,,bKkCkbWZuhY,2/1/17,Watford clip Arsenal in 2-1 win
Tottenham,,Sunderland,,G7E-PEPBOBw,2/1/17,Sunderland earn draw against Tottenham
Leicester City,,Burnley,,i7egyQF4qhk,2/1/17,Burnley score late to get win against Leicester
Chelsea,,Liverpool,,QsW7CmteVAA,1/25/17,Chelsea set to visit struggling Liverpool at Anfield
Southampton,,Leicester City,,0wKpv4sEeE0,1/22/17,Southampton stifle Leicester City in 3-0 win
Arsenal,,Burnley,,V8FPdwuH8XI,1/22/17,Arsenal snatch win from Burnley with late PK
Chelsea,,Hull City,,8Z83zbFS3Kk,1/22/17,Chelsea beat Hull City as Diego Costa returns
West Ham,,Middlesbrough,,e3xGKzX42dw,1/21/17,West Ham too much for Middlesbrough in 3-1 win
Everton,,Palace,,vW2zbL0LoMo,1/21/17,Everton get late goal to earn win over Palace
Liverpool,,Swansea City,,eAgJqt8ltnU,1/21/17,Swansea City shock Liverpool in 3-2 thriller
West Brom,,Sunderland,,41eo49cVwM8,1/21/17,West Brom power past Sunderland for 2-0 win
Manchester United,,Stoke City,,CyvE-Rtmm1Q,1/21/17,Wayne Rooney's historic goal forces Man United's 1-1 draw with Stoke City
Tottenham,2,Manchester City,2,zgXTuSnG23k,1/21/17,"Manchester City opened the second half with two quick goals, but could not maintain their lead as Tottenham came back to earn a point with a 2-2 draw."
Bournemouth,,Watford,,UB1kdWfqOx4,1/21/17,Bournemouth come back to earn draw with Watford
Liverpool,,Manchester United,,TZW3iTc08l0,1/15/17,Man United  Liverpool share points in 1-1 draw
Everton,,Crystal Palace,,BuLkFq7mCOQ,1/15/17,Everton top Manchester City in 4-0 blowout
Chelsea,,Leicester City,,G0sEEy7BO00,1/14/17,Even without Costa  Chelsea crush Leicester
Tottenham,,West Brom,,iuHbp3sOk4o,1/14/17,Kane's hat-trick leads Tottenham past West Brom
Watford,,Middlesbrough,,4QtUBOsRhvE,1/14/17,Watford  Middlesbrough play to scoreless draw
Southampton,,Burnley,,ydUOwutg64o,1/14/17,Joey Barton's goal helps Burnley past Southampton
Stoke City,,Sunderland,,IfMqji-U9lA,1/14/17,Stoke City power past Sunderland in 3-1 win
Bournemouth,,Hull City,,FMFuaX7lO7g,1/14/17,Hull City come back to beat Bournemouth 3-1
Arsenal,,Swansea City,,6GEfTCNMlBM,1/14/17,Arsenal too much for Swansea City in 4-0 win
West Ham,,Crystal Palace,,f1HTpWYh6_0,1/14/17,West Ham thrash Crystal Palace in 3-0 win
Arsenal,,Bournemouth,,PuZozAYyXxU,1/3/17,Arsenal come back in 3-3 thriller v. Bournemouth
Crystal Palace,,Swansea City,,XwTbG8sTHSc,1/3/17,Swansea earn vital relegation battle win v. Crystal Palace
Stoke City,,Watford,,rMdFQXqo7ww,1/3/17,Stoke City handle Watford in 2-0 win
Everton,,Southampton,,jVSkDQ22b1c,1/3/17,Everton pull away from Southampton for 3-0 win
West Brom,,Hull City,,JA46KzuFEFU,1/3/17,West Brom power past Hull City in 3-1 win
Burnley,,Crystal Palace,,Tqa7jgQoZfk,1/3/17,10-man Manchester City beat Burnley 2-1
Manchester United,,West Ham,,LastE_ZtdY0,1/3/17,Man United earn 6th straight PL win v. 10-man West Ham
Leicester City,,Middlesbrough,,LAoO_Lkw8Ng,1/3/17,Middlesbrough  Leicester play to scoreless draw
Liverpool,,Sunderland,,wUKF7oe0x0I,1/3/17,Sunderland earn 2-2 draw against Liverpool
Tottenham,,Watford,,bASx1vnXs6Q,1/2/17,Harry Kane  Dele Alli lead Tottenham past Watford
Arsenal,,Crystal Palace,,JuYwGwQOu4I,1/2/17,Giroud's wondergoal sparks Arsenal to win over Crystal Palace
Chelsea,,Stoke City,,Yq35nevQ3e8,1/2/17,Chelsea top Stoke City in 4-2 thriller
Leicester City,,West Ham,,FUbZ-kE8jPo,1/2/17,Leicester City hold off West Ham for 1-0 win
Burnley,,Sunderland,,6XCqThr_YGU,1/2/17,Andre Gray's hat-trick leads Burnley to win over Sunderland
Bournemouth,,Swansea City,,bMi5s5LJMqI,1/2/17,Bournemouth puts three goals past Swansea in win
West Brom,,Southampton,,W0zAy_qgtHM,1/2/17,Southampton score first  but fall to West Brom
Manchester United,,Middlesbrough,,ceLw9g0rrms,1/2/17,Manchester United come back to beat Middlesbrough
Liverpool,,Crystal Palace,,R3YqoBnA3Dw,1/2/17,Wijnaldum's goal helps Liverpool to ugly win over Manchester City
Hull City,2,Everton,2,4YmYvYOkki8,12/30/16,"Hull City held a 2-1 lead late in the second half, but Ross Barkley's late equalizer secured a point for the Toffees."
Tottenham,,Southampton,,hHFiYz0ezVw,12/29/16,Dele Alli sparks Tottenham rout of Southampton
Liverpool,,Stoke City,,NCLTGPuZVI0,12/28/16,Liverpool score four unanswered goal to beat Stoke
Manchester City,,Hull City,,QxiM1Zv9k6s,12/26/16,Toure  Iheanacho spark Man City's second half dominance vs. Hull City
West Ham,,Swansea City,,BCCHOI2Pcds,12/26/16,West Ham hammer Swansea City 4-1
Arsenal,,West Brom,,PNNmm_gZmg4,12/26/16,Olivier Giroud's late goal gives Arsenal the win over West Brom
Burnley,,Middlesbrough,,VHRt0GfVuc0,12/26/16,Andre Gray's late goal pushes Burnley past Middlesbrough
Everton,,Leicester City,,Zvqqd7xeYLU,12/26/16,Everton use strong second half to beat Leicester City
Manchester United,,Sunderland,,s8Xa4wAJqSQ,12/26/16,Manchester United continue to roll with 3-1 win over Sunderland
Watford,,Crystal Palace,,Zehg_I6WuJo,12/26/16,Watford  Crystal Palace play to 1-1 draw on Boxing Day
Chelsea,,Bournemouth,,q7jgFM63VQA,12/26/16,Chelsea thump Bournemouth for 12th straight win
Liverpool,,Everton,,170quwYWEgY,12/20/16,Liverpool escape Merseyside derby with win over Everton
Swansea City,,Middlesbrough,,viDz9Smh8oo,12/18/16,Swansea City no match for Middlesbrough in 3-0 defeat
Chelsea,,Crystal Palace,,48L_9lbPfAw,12/18/16,Chelsea beat Crystal Palace for 11th straight win
West Ham,,Hull City,,aQ2r993ploY,12/18/16,Mark Noble's penalty kick goal helps West Ham past Hull City
Manchester United,,West Brom,,zQE5oLpHKEI,12/18/16,Zlatan Ibrahimovic scores two goals as Manchester United best West Brom
Leicester City,,Stoke City,,wIaWaUppyB4,12/18/16,10-man Leicester City comeback to earn 2-2 draw v. Stoke City
Watford,,Sunderland,,7ar7aa9Fm_A,12/18/16,Sunderland top Watford in 1-0 win
Southampton,,Bournemouth,,odb7-O4DtOo,12/18/16,Jay Rodriguez's brace leads Southampton past Bournemouth
Tottenham,,Burnley,,TC_IDhJN_zk,12/18/16,Dele Alli  Danny Rose score as Tottenham beat Burnley 2-1
Arsenal,,Crystal Palace,,ypuoN0Rm3o4,12/18/16,Dominant second half helps Manchester City beat Arsenal 2-1
Burnley,,West Ham,,wOkltfvxwiM,12/15/16,West Ham edge Burnley 1-0 for pivotal win
Southampton,,Stoke City,,KK6cWIZv6wY,12/15/16,Stoke City  Southampton play to scoreless draw
Tottenham,,Hull City,,MJS-sxqTveg,12/15/16,Tottenham trounce Hull City 3-0
West Brom,,Swansea City,,rV_b9dtEwWI,12/15/16,Salomon Rondon's hat trick leads West Brom past Swansea City
Manchester United,,Crystal Palace,,vRWc_a4gKIk,12/15/16,Zlatan Ibrahimovic's late goal helps Manchester United past Crystal Palace
Watford,,Crystal Palace,,UaHmLnUVHQo,12/15/16,Manchester City too much for Watford in 2-0 win
Liverpool,,Middlesbrough,,qUjYGUZbLkQ,12/15/16,Liverpool dismantle Middlesbrough in 3-0 win
Chelsea,,Sunderland,,yHJHM72O_eA,12/15/16,Chelsea top Sunderland  wins 10th straight
Arsenal,,Everton,,yuvBGnBWsfg,12/14/16,Ashley Williams provides late winner as Everton top Arsenal
Bournemouth,,Leicester City,,N-UsBSiXc3A,12/13/16,Bournemouth hold on to top Leicester City 1-0
Liverpool,,West Ham,,ZTBES2Tc54s,12/11/16,Liverpool draw 2-2 with West Ham
Southampton,,Middlesbrough,,Aal2cOmxwd8,12/11/16,Southampton clip Middlesbrough for win
Tottenham,,Manchester United,,H5QoneNMBy0,12/11/16,Henrikh Mkhitaryan's goal helps Manchester United beat Tottenham
Chelsea,,West Brom,,u73zxazkdcI,12/11/16,Diego Costa leads Chelsea past West Brom for ninth straight win
Manchester City,,Leicester City,,96qmy_q4RuU,12/11/16,Jamie Vardy's incredible hat trick seals a Leicester win v. Man City
Crystal Palace,,Hull City,,eLxfhMKr1hk,12/10/16,Hull CIty  Crystal Palace play to 3-3 draw
Bournemouth,,Burnley,,zhe8RwLIIl4,12/10/16,Burnley holds on to beat Bournemouth 3-2
Arsenal,,Stoke City,,8pzcqNCgzfE,12/10/16,Arsenal put three goals past Stoke City in win
Swansea City,,Sunderland,,J7kQ_98GvkU,12/10/16,Swansea City dismantle Sunderland in big win
Everton,,Watford,,QRrN_aXckgg,12/10/16,Watford comes back from a goal down to beat Everton
Hull City,,Middlesbrough,,j3xb6I3xsos,4/6/17,Middlesbrough get by Hull City
Manchester United,,Everton,,spb6lS4wIDU,12/4/16,Manchester United and Everton play to 1-1 draw
Liverpool,,Bournemouth,,AlI5VHMZflo,12/4/16,Bournemouth tops Liverpool 4-3 with thrilling comeback
Arsenal,,West Ham,,XAnkKGgSw5s,12/3/16,Arsenal dominate West Ham in 5-1 win
Stoke City,,Burnley,,tCj7EwsWG3o,12/3/16,Stoke City handle Burnley 2-0
Southampton,,Crystal Palace,,rOFRSJfgB3k,12/3/16,Crystal Palace bury Southampton in three-goal win
Tottenham,,Swansea City,,5C5MKH4oXBQ,12/3/16,Tottenham thump Swansea City 5-0
