Team1,Score1,Team2,Score2,video link,title,date
Stoke City,1,Manchester United,1,OZFOReviNV4,"Joe Allen's late goal equalized for Stoke City, as Manchester United walked away with a disappointing draw in Matchday 7.",10/2/16
Arsenal,1,Burnley,0,1GAPIk5VQs8,Arsenal beats Burnley on late score,10/2/16
Southampton,0,Leicester City,0,s7XbPZLJlJE,Leicester-Southampton play to exciting draw,10/1/16
West Ham,1,Middlesbrough,1,A79tXHV-Dkg,Payet ensures a draw for West Ham v. Middlesbrough,10/1/16
Bournemouth,2,Watford,2,C-uZK8yvpCk,Watford seals draw vs. Bournemouth,10/1/16
Sunderland,1,West Brom,1,T81geDHBk1A,Sunderland's Patrick van Aanholt came off the bench to score a late goal and force a 1-1 draw between the Black Cats and West Brom.,10/1/16